{
  "id": "cleveland-first-riders",
  "label": "First Riders",
  "description": "Cleveland, bus only. Carry 300 daily riders before day 45.",
  "cityKey": "cleveland",
  "tier": 1,
  "difficulty": "easy",
  "startingBudget": 12000000,
  "startingModes": ["bus"],
  "lockModes": true,
  "dailySubsidy": 35000,
  "deadlineDays": 45,
  "eraLabel": "Starter",
  "win": {
    "metric": "dailyTransitTrips",
    "op": ">=",
    "value": 300,
    "label": "Carry 300 daily riders"
  }
}
