{
  "id": "cleveland-five-hundred",
  "label": "Five Hundred",
  "description": "Tutorial adjacent. Carry 500 daily riders on buses before day 50.",
  "cityKey": "cleveland",
  "tier": 1,
  "difficulty": "easy",
  "startingBudget": 12000000,
  "startingModes": ["bus"],
  "lockModes": true,
  "dailySubsidy": 32000,
  "deadlineDays": 50,
  "eraLabel": "Lesson",
  "win": {
    "metric": "dailyTransitTrips",
    "op": ">=",
    "value": 500,
    "label": "Carry 500 daily riders"
  }
}
